{
  "$schema": "https://json-schema.org/draft/2020-12/schema",
  "$id": "https://genealogy.archive/schemas/entities/person.schema.json",
  "title": "Person",
  "version": "1.0.4",
  "description": "Represents an individual person entity in the master registry, utilizing centralized shared definitions.",
  "type": "object",
  "unevaluatedProperties": false,
  "required": [
    "person_id",
    "display_name",
    "canonical_name"
  ],
  "properties": {
    "person_id": {
      "$ref": "../defs/_shared_defs.schema.json#/$defs/person_id"
    },
    "display_name": {
      "type": "string",
      "description": "Primary preferred name for listing and UI rendering."
    },
    "sex": {
      "$ref": "../defs/_enums.schema.json#/$defs/enum_sex"
    },
    "canonical_name": {
      "$ref": "../defs/_shared_defs.schema.json#/$defs/canonical_name"
    },
    "vitals": {
      "type": "object",
      "unevaluatedProperties": false,
      "properties": {
        "birth": {
          "type": "object",
          "unevaluatedProperties": false,
          "properties": {
            "date": {
              "$ref": "../defs/_shared_defs.schema.json#/$defs/date_interpreted"
            },
            "place": {
              "$ref": "../defs/_shared_defs.schema.json#/$defs/location"
            }
          }
        },
        "death": {
          "type": "object",
          "unevaluatedProperties": false,
          "properties": {
            "date": {
              "$ref": "../defs/_shared_defs.schema.json#/$defs/date_interpreted"
            },
            "place": {
              "$ref": "../defs/_shared_defs.schema.json#/$defs/location"
            }
          }
        }
      }
    },
    "external_identifiers": {
      "$ref": "../defs/_shared_defs.schema.json#/$defs/external_identifiers"
    },
    "notes": {
      "type": [
        "array",
        "null"
      ],
      "description": "Structured notes and research tracking entries for the entity.",
      "items": {
        "$ref": "../defs/_shared_defs.schema.json#/$defs/note_entry"
      }
    },
    "last_updated": {
      "type": "string",
      "description": "ISO-8601 timestamp representing the last modification to this entity."
    },
    "associated_people": {
      "type": [
        "array",
        "null"
      ],
      "description": "Linked secondary people or non-minted parents/kin with assigned roles.",
      "items": {
        "$ref": "../defs/_shared_defs.schema.json#/$defs/associated_person_entry"
      }
    },
    "unions": {
      "type": "array",
      "description": "List of domestic partnerships and spousal unions for identity, disambiguation, and chronological indexing.",
      "items": {
        "type": "object",
        "unevaluatedProperties": false,
        "required": [
          "spouse_id",
          "status"
        ],
        "properties": {
          "spouse_id": {
            "$ref": "../defs/_shared_defs.schema.json#/$defs/person_id",
            "description": "Identifier of the spouse or domestic/biological co-parent."
          },
          "status": {
            "$ref": "../defs/_enums.schema.json#/$defs/enum_union_status",
            "description": "Current or final lifecycle status of the partnership."
          },
          "marriage_date": {
            "$ref": "../defs/_shared_defs.schema.json#/$defs/date_interpreted",
            "description": "Working date and modifier for wedding or union establishment."
          },
          "end_date": {
            "$ref": "../defs/_shared_defs.schema.json#/$defs/date_interpreted",
            "description": "Working date and modifier for union dissolution, divorce, or termination."
          },
          "place": {
            "$ref": "../defs/_shared_defs.schema.json#/$defs/location",
            "description": "Geographic location of the marriage or domestic union."
          },
          "notes": {
            "type": [
              "string",
              "null"
            ],
            "description": "Working contextual note regarding union circumstances or unverified source mentions."
          }
        }
      }
    }
  }
}
