{
  "person_id": "TMP-01002",
  "display_name": "Julian Thomas Sterling",
  "canonical_name": {
    "given": "Julian",
    "surname": "Sterling",
    "birth_year": {
      "year": 1991,
      "modifier": "EXACT"
    }
  },
  "sex": "Male",
  "vitals": {
    "birth": {
      "date": {
        "date_start": "1991-07-22",
        "modifier": "EXACT"
      },
      "place": {
        "verbatim": "Carlisle, PA",
        "standardized": "Carlisle, Cumberland County, Pennsylvania, USA"
      }
    }
  },
  "notes": [],
  "associated_people": [
    {
      "person_id": "IND-00000",
      "role": "FATH"
    }
  ],
  "unions": []
}