{
  "person_id": "TMP-01004",
  "display_name": "Lucas Henry Sterling",
  "canonical_name": {
    "given": "Lucas",
    "surname": "Sterling",
    "birth_year": {
      "year": 2018,
      "modifier": "EXACT"
    }
  },
  "sex": "Male",
  "vitals": {
    "birth": {
      "date": {
        "date_start": "2018-09-30",
        "modifier": "EXACT"
      },
      "place": {
        "verbatim": "Carlisle, PA",
        "standardized": "Carlisle, Cumberland County, Pennsylvania, USA"
      }
    }
  },
  "notes": [],
  "associated_people": [
    {
      "person_id": "TMP-01002",
      "role": "FATH"
    },
    {
      "person_id": "TMP-01003",
      "role": "MOTH"
    }
  ],
  "unions": []
}